{
  "profile_name": "bess-hil-simulator",
  "unit_id_discovery": "static",
  "static_unit_id": 1,
  "registers": [
    {
      "name": "active_power_kw",
      "display_name": "Active Power",
      "unit": "kW",
      "address": 1,
      "register_table": "input",
      "type": "float32",
      "word_order": "low_high",
      "scale_factor": 1000,
      "range": [-250, 250],
      "writable": false,
      "write_cadence": "cyclic",
      "auth_required": "none"
    },
    {
      "name": "reactive_power_kvar",
      "display_name": "Reactive Power",
      "unit": "kvar",
      "address": 3,
      "register_table": "input",
      "type": "float32",
      "word_order": "low_high",
      "scale_factor": 1000,
      "range": [-250, 250],
      "writable": false,
      "write_cadence": "cyclic",
      "auth_required": "none"
    },
    {
      "name": "grid_voltage_pu",
      "display_name": "Grid Voltage",
      "unit": "pu",
      "address": 5,
      "register_table": "input",
      "type": "float32",
      "word_order": "low_high",
      "scale_factor": 1,
      "range": [0, 2],
      "writable": false,
      "write_cadence": "cyclic",
      "auth_required": "none"
    },
    {
      "name": "grid_frequency_hz",
      "display_name": "Grid Frequency",
      "unit": "Hz",
      "address": 7,
      "register_table": "input",
      "type": "float32",
      "word_order": "low_high",
      "scale_factor": 1,
      "range": [45, 65],
      "writable": false,
      "write_cadence": "cyclic",
      "auth_required": "none"
    },
    {
      "name": "grid_current_ka",
      "display_name": "Grid Current",
      "unit": "kA",
      "address": 9,
      "register_table": "input",
      "type": "float32",
      "word_order": "low_high",
      "scale_factor": 1,
      "range": [-10, 10],
      "writable": false,
      "write_cadence": "cyclic",
      "auth_required": "none"
    },
    {
      "name": "active_power_setpoint_kw",
      "display_name": "Active Power Setpoint",
      "unit": "kW",
      "address": 1,
      "register_table": "holding",
      "type": "float32",
      "word_order": "low_high",
      "scale_factor": 1000,
      "range": [-250, 250],
      "writable": true,
      "write_cadence": "cyclic",
      "auth_required": "none"
    },
    {
      "name": "reactive_power_setpoint_kvar",
      "display_name": "Reactive Power Setpoint",
      "unit": "kvar",
      "address": 3,
      "register_table": "holding",
      "type": "float32",
      "word_order": "low_high",
      "scale_factor": 1000,
      "range": [-250, 250],
      "writable": true,
      "write_cadence": "cyclic",
      "auth_required": "none"
    }
  ]
}
